{
  "$schema": "http://json-schema.org/draft-04/schema#",
  "description": "",
  "type": "object",
  "properties": {
    "name": {
      "type": "string",
      "minLength": 1
    },
    "title": {
      "type": "string",
      "minLength": 1
    },
    "type": {
      "type": "string",
      "minLength": 1
    },
    "value": {
      "type": "number"
    },
    "latestValueAt": {
      "type": "string",
      "minLength": 1
    },
    "unit": {
      "type": "object",
      "properties": {
        "label": {
          "type": "string",
          "minLength": 1
        },
        "symbol": {
          "type": "string",
          "minLength": 1
        }
      },
      "required": [
        "label",
        "symbol"
      ]
    },
    "device": {
      "type": "string",
      "minLength": 1
    },
    "created": {
      "type": "string",
      "minLength": 1
    },
    "updated": {
      "type": "string",
      "minLength": 1
    },
    "mainfluxPrivate": {
      "type": "object",
      "properties": {},
      "required": []
    }
  },
  "required": [
    "name",
    "title",
    "type",
    "value",
    "latestValueAt",
    "unit",
    "device",
    "created",
    "updated",
    "mainfluxPrivate"
  ]
}