{
    "name": "temperature",
    "title": "Living Room Temperature",
    "type": "numeric",
    "value": 32,
    "latestValueAt":"2014-09-10T19:15:01.325Z",
    "unit": {
        "label": "celsius",
        "symbol": "C"
    },
    "device": "88fce370-1c68-11e6-8610-27f9510f1a02",
    "created": "2014-09-09T19:15:00.344Z",
    "updated": "2014-09-10T19:15:00.390Z",
    "mainfluxPrivate": {}
}
